{
  "semantics": {
    "tolerance": "ciede2000-lab-d65-v1",
    "metrics": ["wcag21-contrast-ratio"]
  },
  "mood": {
    "paper-quiet": {
      "descriptor": "descriptor:mood:paper-quiet",
      "viewing": "table-reading"
    }
  },
  "constraints": {
    "colors": {
      "mark-ink": {
        "color": "palette:board.mark-ink",
        "tolerance": 12,
        "scope": {
          "applies_to": "every placed mark and every grid line",
          "states": ["in-game"],
          "sampling": "exhaustive"
        }
      }
    }
  },
  "viewing": {
    "table-reading": {
      "speed_and_size": "the whole board on screen at once, at real play speed",
      "calibration": "sRGB display at standard desktop viewing distance",
      "hide_builder_name": true
    }
  }
}
